<!ELEMENT stock (coche+)>
<!ELEMENT coche (marca, modelo, motor, precio)>
<!ATTLIST coche categoria (deportivo|SUV|berlina) #REQUIRED>
<!ELEMENT marca (#PCDATA)>
<!ELEMENT modelo (#PCDATA)>
<!ELEMENT motor (#PCDATA)>
<!ELEMENT precio (#PCDATA)>
<!ATTLIST precio moneda CDATA #FIXED "EUR">